{
  "navigation": [
    {
      "title": "Maps",
      "maps": [
        "one"
      ]
    }
  ],
  "areas": [
    {
      "map": "one",
      "id": "scope",
      "title": "Scope"
    }
  ],
  "points": [
    {
      "point": "service-boundary",
      "kinds": [
        "decision"
      ]
    }
  ],
  "checks": [
    {
      "check": "expected-name",
      "level": "required",
      "applies-to": [
        "check"
      ]
    }
  ]
}
