{
  "navigation": [
    {
      "title": "Maps",
      "maps": [
        "one"
      ]
    }
  ],
  "resources": [
    {
      "id": "overview",
      "uri": "docs/overview.md",
      "title": "Fixture overview"
    }
  ],
  "areas": [
    {
      "map": "one",
      "id": "scope",
      "title": "Scope"
    }
  ],
  "points": [
    {
      "point": "service-boundary",
      "kinds": [
        "decision"
      ]
    }
  ],
  "checks": [
    {
      "check": "review",
      "level": "advisory",
      "applies-to": [
        "publication"
      ]
    }
  ]
}
